{
 "argv": [
  "--summary",
  "ablation_summary.json"
 ],
 "build": {
  "base_build_id": "build-b",
  "publication": {
   "build_id": "build-b+chain-x",
   "manifest_file": "publications/chain-x.json",
   "sha256": "1111111111111111111111111111111111111111111111111111111111111111"
  },
  "publication_reason": null
 },
 "command": "run_ablations",
 "config": {
  "code_version": "0000000000ab",
  "metrics_version": "metrics.v2",
  "mode": "live",
  "strategies": [
   "plain_llm"
  ]
 },
 "counts": {
  "items_total": 2,
  "items_with_errors": 0,
  "units_without_usage": 0
 },
 "ended_at": "2026-09-20T13:00:00+00:00",
 "inputs": [
  {
   "file": "layer1.json",
   "input_kind": "layer1_dump",
   "sha256": "aaaaaaaaaaaaaaaaaaaaaaaaaaaaaaaaaaaaaaaaaaaaaaaaaaaaaaaaaaaaaaaa"
  },
  {
   "file": "norms_core.json",
   "input_kind": "norms",
   "sha256": "bbbbbbbbbbbbbbbbbbbbbbbbbbbbbbbbbbbbbbbbbbbbbbbbbbbbbbbbbbbbbbbb"
  },
  {
   "file": "benchmark_sample.json",
   "input_kind": "benchmark",
   "sha256": "cccccccccccccccccccccccccccccccccccccccccccccccccccccccccccccccc"
  },
  {
   "file": "gold_seed.json",
   "input_kind": "gold_seed",
   "sha256": "dddddddddddddddddddddddddddddddddddddddddddddddddddddddddddddddd"
  },
  {
   "file": "benchmark_features.json",
   "input_kind": "features",
   "sha256": "eeeeeeeeeeeeeeeeeeeeeeeeeeeeeeeeeeeeeeeeeeeeeeeeeeeeeeeeeeeeeeee"
  }
 ],
 "item_selection_sha256": "8cecca935708aca7ed57e43c607666d13ace2e7cbe579071fbfe4fadcfb3f45e",
 "kind": "run",
 "models": {
  "generator_model": "g",
  "judge_model": "j"
 },
 "notes": [],
 "observed_at": "2026-09-26T00:00:00+00:00",
 "origin": "recorded",
 "outcome": {
  "completed_items": [
   "gold:cls-01",
   "gold:cls-02"
  ],
  "error": null,
  "intended_items": [
   "gold:cls-01",
   "gold:cls-02"
  ],
  "status": "completed"
 },
 "outputs": [
  {
   "copy": "e6a000000002/summary.json",
   "copy_reason": null,
   "copy_state": "present",
   "file": "ablation_summary.json",
   "output_kind": "summary",
   "sha256": "c26e6fd6553aead5afb6c9a55975591647d50f54d4f30bfe28e0b1c300c6e9ac"
  },
  {
   "copy": "e6a000000002/checkpoint.jsonl",
   "copy_reason": null,
   "copy_state": "present",
   "file": "ablation_checkpoint.jsonl",
   "output_kind": "checkpoint",
   "sha256": "33c319c41136fdcc3459a65374e36c127f4950ecaef2812c329f88d702db982f"
  }
 ],
 "prompt_sha256": null,
 "prompt_versions": {
  "generator": "v1",
  "judge": "v1"
 },
 "provenance": {
  "argv": "recorded",
  "build": "recorded",
  "command": "recorded",
  "config": "recorded",
  "counts": "recorded",
  "ended_at": "recorded",
  "inputs": "recorded",
  "item_selection_sha256": "recorded",
  "kind": "recorded",
  "models": "recorded",
  "notes": "recorded",
  "origin": "recorded",
  "outcome": "recorded",
  "outputs": "recorded",
  "prompt_sha256": "unavailable",
  "prompt_versions": "recorded",
  "record_id": "recorded",
  "relations": "recorded",
  "sampling": "recorded",
  "schema_version": "recorded",
  "started_at": "recorded",
  "step": "recorded",
  "usage": "recorded"
 },
 "reasons": {
  "prompt_sha256": "not recorded: the ablation runner reads no prompt hash"
 },
 "record_id": "e6a000000002",
 "relations": {
  "compares": [],
  "labelling_record_ids": [],
  "repeat_of": "e6a000000001",
  "resumes_record_id": null,
  "sample_id": null
 },
 "sampling": {
  "generator": "temperature=0",
  "judge": "API default"
 },
 "schema_version": "evaluation_record.v2",
 "started_at": "2026-09-20T12:00:00+00:00",
 "step": "E6",
 "synthesised": false,
 "usage": {
  "generator": {
   "calls": 2,
   "input_tokens": 10,
   "output_tokens": 4
  },
  "judge": {
   "calls": 1,
   "input_tokens": 5,
   "output_tokens": 2
  }
 }
}
