{
 "argv": [
  "--sheet",
  "judge_label_sheet.json"
 ],
 "build": {
  "base_build_id": "build-b",
  "publication": {
   "build_id": "build-b+chain-x",
   "manifest_file": "publications/chain-x.json",
   "sha256": "1111111111111111111111111111111111111111111111111111111111111111"
  },
  "publication_reason": null
 },
 "command": "sample_judge_decisions",
 "config": {
  "code_version": "0000000000ab",
  "minimum": 3,
  "strata": [
   {
    "judge_kind": "extraction",
    "population": 4,
    "sampled": 2,
    "verdict": "accepted"
   }
  ],
  "total": 50
 },
 "counts": {
  "population": 4,
  "sampled": 2,
  "unjoinable": 0
 },
 "ended_at": "2026-09-24T13:00:00+00:00",
 "inputs": [
  {
   "file": "norms_core.json",
   "input_kind": "norms",
   "sha256": "bbbbbbbbbbbbbbbbbbbbbbbbbbbbbbbbbbbbbbbbbbbbbbbbbbbbbbbbbbbbbbbb"
  },
  {
   "file": "alignments_core.json",
   "input_kind": "alignments",
   "sha256": "9999999999999999999999999999999999999999999999999999999999999999"
  },
  {
   "file": "layer1.json",
   "input_kind": "layer1_dump",
   "sha256": "aaaaaaaaaaaaaaaaaaaaaaaaaaaaaaaaaaaaaaaaaaaaaaaaaaaaaaaaaaaaaaaa"
  }
 ],
 "item_selection_sha256": null,
 "kind": "sample",
 "models": null,
 "notes": [],
 "observed_at": "2026-09-26T00:00:00+00:00",
 "origin": "recorded",
 "outcome": {
  "completed_items": [
   "jr-1",
   "jr-2"
  ],
  "error": null,
  "intended_items": [
   "jr-1",
   "jr-2"
  ],
  "status": "completed"
 },
 "outputs": [
  {
   "copy": "e1a000000001/sheet_json.json",
   "copy_reason": null,
   "copy_state": "present",
   "file": "judge_label_sheet.json",
   "output_kind": "sheet_json",
   "sha256": "ca3d163bab055381827226140568f3bef7eaac187cebd76878e0b63e9e442356"
  },
  {
   "copy": "e1a000000001/sheet_md.md",
   "copy_reason": null,
   "copy_state": "present",
   "file": "judge_label_sheet.md",
   "output_kind": "sheet_md",
   "sha256": "894e2bb67e87c0d0cbb0b00ff6d7e374849bcf2378001b73823d341744196f68"
  }
 ],
 "prompt_sha256": null,
 "prompt_versions": null,
 "provenance": {
  "argv": "recorded",
  "build": "recorded",
  "command": "recorded",
  "config": "recorded",
  "counts": "recorded",
  "ended_at": "recorded",
  "inputs": "recorded",
  "item_selection_sha256": "unavailable",
  "kind": "recorded",
  "models": "unavailable",
  "notes": "recorded",
  "origin": "recorded",
  "outcome": "recorded",
  "outputs": "recorded",
  "prompt_sha256": "unavailable",
  "prompt_versions": "unavailable",
  "record_id": "recorded",
  "relations": "recorded",
  "sampling": "unavailable",
  "schema_version": "recorded",
  "started_at": "recorded",
  "step": "recorded",
  "usage": "unavailable"
 },
 "reasons": {
  "item_selection_sha256": "not recorded",
  "models": "not applicable: no model is called",
  "prompt_sha256": "not applicable: no model is called",
  "prompt_versions": "not applicable: no model is called",
  "sampling": "not applicable: no model is called",
  "usage": "not applicable: no model is called"
 },
 "record_id": "e1a000000001",
 "relations": {
  "compares": [],
  "labelling_record_ids": [],
  "repeat_of": null,
  "resumes_record_id": null,
  "sample_id": "sample-a1b2c3d4e5f6"
 },
 "sampling": null,
 "schema_version": "evaluation_record.v2",
 "started_at": "2026-09-24T12:00:00+00:00",
 "step": "E1",
 "synthesised": false,
 "usage": null
}
