{
 "argv": [
  "--label",
  "jr-1",
  "accept",
  "--by",
  "Jose"
 ],
 "build": {
  "base_build_id": "build-b",
  "publication": {
   "build_id": "build-b+chain-x",
   "manifest_file": "publications/chain-x.json",
   "sha256": "1111111111111111111111111111111111111111111111111111111111111111"
  },
  "publication_reason": null
 },
 "command": "sample_judge_decisions",
 "config": {
  "by": "Jose",
  "forced": [],
  "labels": {
   "jr-1": "accept",
   "jr-2": "reject"
  }
 },
 "counts": {
  "items": 2,
  "labelled_now": 2,
  "labelled_total": 2
 },
 "ended_at": "2026-09-25T11:00:00+00:00",
 "inputs": [
  {
   "file": "judge_label_sheet.json",
   "input_kind": "sheet_before",
   "sha256": "3333333333333333333333333333333333333333333333333333333333333333"
  }
 ],
 "item_selection_sha256": null,
 "kind": "labelling",
 "models": null,
 "notes": [],
 "observed_at": "2026-09-26T00:00:00+00:00",
 "origin": "recorded",
 "outcome": {
  "completed_items": [
   "jr-1",
   "jr-2"
  ],
  "error": null,
  "intended_items": [
   "jr-1",
   "jr-2"
  ],
  "status": "completed"
 },
 "outputs": [
  {
   "copy": "e1b000000001/sheet_after.json",
   "copy_reason": null,
   "copy_state": "present",
   "file": "judge_label_sheet.json",
   "output_kind": "sheet_after",
   "sha256": "2202fa8412cc9ff04b26f09d1c01426126eabdc48965762e8244fdd21a15dbeb"
  }
 ],
 "prompt_sha256": null,
 "prompt_versions": null,
 "provenance": {
  "argv": "recorded",
  "build": "recorded",
  "command": "recorded",
  "config": "recorded",
  "counts": "recorded",
  "ended_at": "recorded",
  "inputs": "recorded",
  "item_selection_sha256": "unavailable",
  "kind": "recorded",
  "models": "unavailable",
  "notes": "recorded",
  "origin": "recorded",
  "outcome": "recorded",
  "outputs": "recorded",
  "prompt_sha256": "unavailable",
  "prompt_versions": "unavailable",
  "record_id": "recorded",
  "relations": "recorded",
  "sampling": "unavailable",
  "schema_version": "recorded",
  "started_at": "recorded",
  "step": "recorded",
  "usage": "unavailable"
 },
 "reasons": {
  "item_selection_sha256": "not recorded",
  "models": "not applicable: no model is called",
  "prompt_sha256": "not applicable: no model is called",
  "prompt_versions": "not applicable: no model is called",
  "sampling": "not applicable: no model is called",
  "usage": "not applicable: no model is called"
 },
 "record_id": "e1b000000001",
 "relations": {
  "compares": [],
  "labelling_record_ids": [],
  "repeat_of": null,
  "resumes_record_id": null,
  "sample_id": "sample-a1b2c3d4e5f6"
 },
 "sampling": null,
 "schema_version": "evaluation_record.v2",
 "started_at": "2026-09-25T10:00:00+00:00",
 "step": "E1",
 "synthesised": false,
 "usage": null
}
