{
 "argv": [
  "--strategies",
  "plain_llm"
 ],
 "build": {
  "base_build_id": "build-b",
  "publication": {
   "build_id": "build-b+chain-x",
   "manifest_file": "publications/chain-x.json",
   "sha256": "1111111111111111111111111111111111111111111111111111111111111111"
  },
  "publication_reason": null
 },
 "command": "eval_harness",
 "config": {
  "code_version": "0000000000ab",
  "metrics_version": "metrics.v2",
  "mode": "offline",
  "note": "no live model was called",
  "strategies": [
   "plain_llm"
  ]
 },
 "counts": {
  "items_total": 1,
  "items_with_errors": 0
 },
 "ended_at": "2026-09-22T11:00:00+00:00",
 "inputs": [
  {
   "file": "(in memory)",
   "input_kind": "layer1_dump",
   "sha256": "aaaaaaaaaaaaaaaaaaaaaaaaaaaaaaaaaaaaaaaaaaaaaaaaaaaaaaaaaaaaaaaa"
  },
  {
   "file": "(in memory)",
   "input_kind": "norms",
   "sha256": "bbbbbbbbbbbbbbbbbbbbbbbbbbbbbbbbbbbbbbbbbbbbbbbbbbbbbbbbbbbbbbbb"
  },
  {
   "file": "gold_seed.json",
   "input_kind": "gold_seed",
   "sha256": "dddddddddddddddddddddddddddddddddddddddddddddddddddddddddddddddd"
  }
 ],
 "item_selection_sha256": "4dc8e6536f7fd7304d052733b1a530c89a503aaf95cbba3d9b22182bf9604c62",
 "kind": "run",
 "models": null,
 "notes": [],
 "observed_at": "2026-09-26T00:00:00+00:00",
 "origin": "recorded",
 "outcome": {
  "completed_items": [
   "gold:cls-01"
  ],
  "error": null,
  "intended_items": [
   "gold:cls-01"
  ],
  "status": "completed"
 },
 "outputs": [
  {
   "copy": "e6d000000001/artifact.json",
   "copy_reason": null,
   "copy_state": "present",
   "file": "eval_build-b_deadbeef.json",
   "output_kind": "artifact",
   "sha256": "ca3d163bab055381827226140568f3bef7eaac187cebd76878e0b63e9e442356"
  }
 ],
 "prompt_sha256": null,
 "prompt_versions": null,
 "provenance": {
  "argv": "recorded",
  "build": "recorded",
  "command": "recorded",
  "config": "recorded",
  "counts": "recorded",
  "ended_at": "recorded",
  "inputs": "recorded",
  "item_selection_sha256": "recorded",
  "kind": "recorded",
  "models": "unavailable",
  "notes": "recorded",
  "origin": "recorded",
  "outcome": "recorded",
  "outputs": "recorded",
  "prompt_sha256": "unavailable",
  "prompt_versions": "unavailable",
  "record_id": "recorded",
  "relations": "recorded",
  "sampling": "unavailable",
  "schema_version": "recorded",
  "started_at": "recorded",
  "step": "recorded",
  "usage": "unavailable"
 },
 "reasons": {
  "models": "offline: no live model was called",
  "prompt_sha256": "not applicable: no live model was called",
  "prompt_versions": "not applicable: no live model was called",
  "sampling": "not applicable: no live model was called",
  "usage": "not applicable: no live model was called"
 },
 "record_id": "e6d000000001",
 "relations": {
  "compares": [],
  "labelling_record_ids": [],
  "repeat_of": null,
  "resumes_record_id": null,
  "sample_id": null
 },
 "sampling": null,
 "schema_version": "evaluation_record.v2",
 "started_at": "2026-09-22T10:00:00+00:00",
 "step": "E6",
 "synthesised": false,
 "usage": null
}
