{
 "argv": [
  "--run-a",
  "a",
  "--run-b",
  "b"
 ],
 "build": {
  "base_build_id": "build-b",
  "publication": {
   "build_id": "build-b+chain-x",
   "manifest_file": "publications/chain-x.json",
   "sha256": "1111111111111111111111111111111111111111111111111111111111111111"
  },
  "publication_reason": null
 },
 "command": "variance_report",
 "config": {
  "code_version": "0000000000ab"
 },
 "counts": {
  "common_items": 2,
  "label_flips": 0
 },
 "ended_at": "2026-09-21T13:00:00+00:00",
 "inputs": [
  {
   "file": "ablation_checkpoint.jsonl",
   "input_kind": "run_a",
   "sha256": "1111111111111111111111111111111111111111111111111111111111111111"
  },
  {
   "file": "ablation_checkpoint.jsonl",
   "input_kind": "run_b",
   "sha256": "2222222222222222222222222222222222222222222222222222222222222222"
  },
  {
   "file": "benchmark_sample.json",
   "input_kind": "benchmark",
   "sha256": "cccccccccccccccccccccccccccccccccccccccccccccccccccccccccccccccc"
  }
 ],
 "item_selection_sha256": null,
 "kind": "comparison",
 "models": null,
 "notes": [
  "run_b is named by no record"
 ],
 "observed_at": "2026-09-26T00:00:00+00:00",
 "origin": "recorded",
 "outcome": {
  "completed_items": [
   "gold:cls-01",
   "gold:cls-02"
  ],
  "error": null,
  "intended_items": [
   "gold:cls-01",
   "gold:cls-02"
  ],
  "status": "completed"
 },
 "outputs": [
  {
   "copy": "e6c000000001/study.md",
   "copy_reason": null,
   "copy_state": "present",
   "file": "variance_study.md",
   "output_kind": "study",
   "sha256": "529a6da2be47962b02255518c70951a423aee684b31824a3bdc7d453b63553b5"
  }
 ],
 "prompt_sha256": null,
 "prompt_versions": null,
 "provenance": {
  "argv": "recorded",
  "build": "recorded",
  "command": "recorded",
  "config": "recorded",
  "counts": "recorded",
  "ended_at": "recorded",
  "inputs": "recorded",
  "item_selection_sha256": "unavailable",
  "kind": "recorded",
  "models": "unavailable",
  "notes": "recorded",
  "origin": "recorded",
  "outcome": "recorded",
  "outputs": "recorded",
  "prompt_sha256": "unavailable",
  "prompt_versions": "unavailable",
  "record_id": "recorded",
  "relations": "recorded",
  "sampling": "unavailable",
  "schema_version": "recorded",
  "started_at": "recorded",
  "step": "recorded",
  "usage": "unavailable"
 },
 "reasons": {
  "item_selection_sha256": "not applicable: a comparison calls no model",
  "models": "not applicable: a comparison calls no model",
  "prompt_sha256": "not applicable: a comparison calls no model",
  "prompt_versions": "not applicable: a comparison calls no model",
  "sampling": "not applicable: a comparison calls no model",
  "usage": "not applicable: a comparison calls no model"
 },
 "record_id": "e6c000000001",
 "relations": {
  "compares": [
   "e6a000000001",
   null
  ],
  "labelling_record_ids": [],
  "repeat_of": null,
  "resumes_record_id": null,
  "sample_id": null
 },
 "sampling": null,
 "schema_version": "evaluation_record.v2",
 "started_at": "2026-09-21T12:00:00+00:00",
 "step": "E6",
 "synthesised": false,
 "usage": null
}
