{
 "argv": [
  "--compute"
 ],
 "build": {
  "base_build_id": "build-b",
  "publication": {
   "build_id": "build-b+chain-x",
   "manifest_file": "publications/chain-x.json",
   "sha256": "1111111111111111111111111111111111111111111111111111111111111111"
  },
  "publication_reason": null
 },
 "command": "sample_judge_decisions",
 "config": {
  "metrics_version": "metrics.v2"
 },
 "counts": {
  "abstained": 0,
  "gold_accept": 1,
  "gold_reject": 1,
  "scored": 2
 },
 "ended_at": "2026-09-25T13:00:00+00:00",
 "inputs": [
  {
   "file": "judge_label_sheet.json",
   "input_kind": "sheet_labelled",
   "sha256": "4444444444444444444444444444444444444444444444444444444444444444"
  }
 ],
 "item_selection_sha256": null,
 "kind": "analysis",
 "models": null,
 "notes": [
  "sample estimate: population weighting is not designed"
 ],
 "observed_at": "2026-09-26T00:00:00+00:00",
 "origin": "recorded",
 "outcome": {
  "completed_items": [
   "jr-1",
   "jr-2"
  ],
  "error": null,
  "intended_items": [
   "jr-1",
   "jr-2"
  ],
  "status": "completed"
 },
 "outputs": [
  {
   "copy": "e1c000000001/error_rates.json",
   "copy_reason": null,
   "copy_state": "present",
   "file": "error_rates.json",
   "output_kind": "error_rates",
   "sha256": "b735e0054535175eb47ee9bb38c0f25033634a48abe1dd82036df42ce3c52982"
  }
 ],
 "prompt_sha256": null,
 "prompt_versions": null,
 "provenance": {
  "argv": "recorded",
  "build": "recorded",
  "command": "recorded",
  "config": "recorded",
  "counts": "recorded",
  "ended_at": "recorded",
  "inputs": "recorded",
  "item_selection_sha256": "unavailable",
  "kind": "recorded",
  "models": "unavailable",
  "notes": "recorded",
  "origin": "recorded",
  "outcome": "recorded",
  "outputs": "recorded",
  "prompt_sha256": "unavailable",
  "prompt_versions": "unavailable",
  "record_id": "recorded",
  "relations": "recorded",
  "sampling": "unavailable",
  "schema_version": "recorded",
  "started_at": "recorded",
  "step": "recorded",
  "usage": "unavailable"
 },
 "reasons": {
  "item_selection_sha256": "not recorded",
  "models": "not applicable: no model is called",
  "prompt_sha256": "not applicable: no model is called",
  "prompt_versions": "not applicable: no model is called",
  "sampling": "not applicable: no model is called",
  "usage": "not applicable: no model is called"
 },
 "record_id": "e1c000000001",
 "relations": {
  "compares": [],
  "labelling_record_ids": [
   "e1b000000001"
  ],
  "repeat_of": null,
  "resumes_record_id": null,
  "sample_id": "sample-a1b2c3d4e5f6"
 },
 "sampling": null,
 "schema_version": "evaluation_record.v2",
 "started_at": "2026-09-25T12:00:00+00:00",
 "step": "E1",
 "synthesised": false,
 "usage": null
}
