{
 "argv": [],
 "build": {
  "base_build_id": "build-3b753e5e9297",
  "publication": null,
  "publication_reason": null
 },
 "command": "sample_judge_decisions",
 "config": {},
 "counts": {
  "items": 50,
  "labelled": 0
 },
 "ended_at": null,
 "inputs": [],
 "item_selection_sha256": null,
 "kind": "sample",
 "models": {
  "judge_model": "claude-opus-4-8"
 },
 "notes": [],
 "observed_at": "2026-09-26T00:00:00+00:00",
 "origin": "legacy",
 "outcome": null,
 "outputs": [
  {
   "copy": null,
   "copy_reason": "legacy: the file on disk is the record",
   "copy_state": "not_kept",
   "file": "judge_label_sheet.json",
   "output_kind": "sheet_json",
   "sha256": "636f445d6cf8f585e5825a2c3fd1d70664ecef5319383a048826c930e12ff4f1"
  }
 ],
 "prompt_sha256": null,
 "prompt_versions": null,
 "provenance": {
  "argv": "unavailable",
  "build": "derived",
  "command": "derived",
  "config": "unavailable",
  "counts": "derived",
  "ended_at": "unavailable",
  "inputs": "unavailable",
  "item_selection_sha256": "unavailable",
  "kind": "derived",
  "models": "derived",
  "notes": "unavailable",
  "origin": "derived",
  "outcome": "unavailable",
  "outputs": "derived",
  "prompt_sha256": "unavailable",
  "prompt_versions": "unavailable",
  "record_id": "derived",
  "relations": "unavailable",
  "sampling": "unavailable",
  "schema_version": "derived",
  "started_at": "unavailable",
  "step": "derived",
  "usage": "unavailable"
 },
 "reasons": {
  "argv": "not recorded: the file states none",
  "build": "derived: the sheet names its base build",
  "config": "not recorded: the file states none",
  "ended_at": "not recorded: the file states none",
  "inputs": "not recorded: the file states none",
  "item_selection_sha256": "not recorded: the file states none",
  "models": "derived: the one judge model every item of the sheet names",
  "notes": "not recorded: the file states none",
  "outcome": "not recorded: the sheet states no outcome",
  "prompt_sha256": "not recorded: the file states none",
  "prompt_versions": "not recorded: the file states none",
  "relations": "not recorded: the sheet predates sample ids",
  "sampling": "not recorded: the file states none",
  "started_at": "not recorded: the sheet states no date",
  "usage": "not recorded: the file states none"
 },
 "record_id": "legacy-636f445d6cf8",
 "relations": {
  "compares": [],
  "labelling_record_ids": [],
  "repeat_of": null,
  "resumes_record_id": null,
  "sample_id": null
 },
 "sampling": null,
 "schema_version": "evaluation_record.v2",
 "started_at": null,
 "step": "E1",
 "synthesised": true,
 "usage": null
}
